{
  "schema_version": "capability_declaration.v3",
  "cell_id": "tropical_cyclone_wind_wind",
  "canonical_runtime_artifact": false,
  "pathway_capabilities": [
    {
      "pathway_id": "tropical_cyclone_wind",
      "failure_unit_scalar_dr": "conditional",
      "scenario_loss_given_value_basis": "supported_with_explicit_failure_unit_value_and_exposure_basis",
      "curve_intrinsic_spread": "not_carried",
      "populated_emit_modes": [
        "scalar_mean"
      ],
      "conditions": [
        "exact source-native Jaimes selectors retain model-v1.0 behavior",
        "canonical 5 MW use requires the exact owner-approved proxy policy, asset profile, and covered-value basis IDs",
        "the proxy evaluates the unchanged Jaimes 3.3 MW / 100 m parameters on tc_peak_gust_3s_10m_kmh",
        "the proxy applies only to WT_TURBINE_EQUIPMENT_ASSEMBLY rotor+nacelle+tower screening scope",
        "covered value is 0.63 of project TIV; the remaining 0.37 is withheld, not zero",
        "source-native selectors retain v1.0 withheld-range behavior",
        "the named 5 MW proxy alone assigns zero in 90\u2013108 km/h and caps DR at max_dr above 252 km/h, with explicit flags"
      ],
      "limitation_flags": [
        "OWNER_APPROVED_SCREENING_PROXY",
        "REQUESTED_5MW_EVALUATED_WITH_3P3MW_SOURCE_CURVE",
        "NO_CAPACITY_RATIO_SCALING",
        "NOT_TARGET_MATCHED_5MW_EVIDENCE",
        "NOT_FIELD_CALIBRATED",
        "NOT_CLAIMS_CALIBRATED",
        "PARTIAL_STRUCTURAL_VALUE_COVERAGE_63PCT",
        "UNCOVERED_PROJECT_VALUE_37PCT_WITHHELD_NOT_ZERO",
        "CURVE_INTRINSIC_SPREAD_NOT_CARRIED",
        "NO_NHC_OR_HUB_HEIGHT_BRIDGE",
        "PROXY_SCREENING_TRANSITION_BAND_ZERO_RULE",
        "PROXY_SCREENING_ABOVE_RANGE_MAX_DR_CAP"
      ],
      "withheld_failure_units": [
        {
          "failure_unit_id": "WT_FOUNDATION",
          "reason_codes": [
            "NO_RUNTIME_CURVE_FOR_PATHWAY_UNIT"
          ]
        },
        {
          "failure_unit_id": "WT_PAD_MOUNTED_ELECTRICAL",
          "reason_codes": [
            "NO_RUNTIME_CURVE_FOR_PATHWAY_UNIT",
            "ELECTRICAL_VALUE_SPLIT_REQUIRED"
          ]
        },
        {
          "failure_unit_id": "WT_COLLECTION_SYSTEM",
          "reason_codes": [
            "NO_RUNTIME_CURVE_FOR_PATHWAY_UNIT",
            "LINE_NETWORK_EXPOSURE_REQUIRED"
          ]
        },
        {
          "failure_unit_id": "WT_GSU_SUBSTATION",
          "reason_codes": [
            "NO_RUNTIME_CURVE_FOR_PATHWAY_UNIT",
            "FACILITY_LEVEL_EXPOSURE_REQUIRED"
          ]
        },
        {
          "failure_unit_id": "WT_CONTROL_BUILDING_AND_SCADA",
          "reason_codes": [
            "NO_RUNTIME_CURVE_FOR_PATHWAY_UNIT"
          ]
        },
        {
          "failure_unit_id": "WT_CIVIL_INFRA",
          "reason_codes": [
            "NO_RUNTIME_CURVE_FOR_PATHWAY_UNIT",
            "MIXED_CIVIL_BUCKET_REQUIRES_SPLIT"
          ]
        },
        {
          "failure_unit_id": "SUPPORT_FIELDWORK",
          "reason_codes": [
            "SUPPORT_COST_ALLOCATE_ONCE_AFTER_DISPOSITION",
            "NO_INDEPENDENT_FRAGILITY"
          ]
        },
        {
          "failure_unit_id": "SUPPORT_TRANSPORT_LOGISTICS",
          "reason_codes": [
            "SUPPORT_COST_ALLOCATE_ONCE_AFTER_DISPOSITION",
            "NO_INDEPENDENT_FRAGILITY"
          ]
        }
      ]
    }
  ],
  "consumer_annual_metrics": {
    "computation_owner": "downstream_consumer",
    "status_before_promotion": "withheld_noncanonical_proposal",
    "status_after_promotion": "consumer_computable_from_validated_frequency_intensity_coupling_value_and_cap_model",
    "prerequisites": [
      "released exact cell/model/docs/schema/SHA pin",
      "validated Hurricane event frequency and intensity coupling",
      "exact canonical asset profile and proxy policy identities",
      "0.63 covered-value cap applied at occurrence and annual grains",
      "compound-event partition and full-grid consumer validation"
    ],
    "limitation_flags": [
      "CURVE_INTRINSIC_SPREAD_NOT_CARRIED",
      "PARTIAL_STRUCTURAL_VALUE_COVERAGE_63PCT",
      "ANNUAL_AND_TAIL_METRICS_CONDITIONAL_ON_SCREENING_PROXY"
    ]
  },
  "cap_binding": {
    "policy": "consumer_enforced_fail_closed",
    "enforcement_owner": "downstream_consumer",
    "checks_required": [
      "exact proxy policy, asset profile, value basis, model/docs/schema/SHA pin",
      "covered loss <= 0.63 * project TIV for every occurrence",
      "uncovered 0.37 remains withheld and is never emitted as zero loss",
      "no 5/3.3 multiplier or generic nearest-neighbour selector",
      "proxy boundary completion is exactly zero for 90\u2013108 km/h and max_dr above 252 km/h, with flags",
      "annual/TIV cap is applied inside the annual calculation"
    ],
    "action_if_fail": "withhold scenario loss and all annual or tail metrics"
  },
  "promotion_gate": {
    "status": "ready_for_review",
    "required_before_canonical_use": [
      "old-v-new source-native reproduction",
      "proxy, negative-contract, value-share, and cap known answers",
      "Hazard exact-pin M2-M4 integration and rollback test",
      "owner review of explicit screening grade and partial-value reporting"
    ]
  }
}
